<?xml version="1.0" encoding="UTF-8"?>
<XPerienceOTA xmlns:xsi="http://www.w3.org/2001/XMLSchema-instance" xsi:noNamespaceSchemaLocation="ota.xsd">
        <Stable>
        <falcon>
                        <Filename>9.0.2_r1-20150224-NIGHTLY-falcon</Filename>
                        <DownloadUrl>https://s.basketbuild.com/devs/klozz/XPerience-rom/falcon</DownloadUrl>
        </falcon>
        <ghost>
                        <Filename>9.1.1_r33-20160117-NIGHTLY-ghost</Filename>
                        <DownloadUrl>https://s.basketbuild.com/devs/klozz/XPerience-rom/ghost</DownloadUrl>
        </ghost>
        </Stable>
</XPerienceOTA>
